{
  "id": "USA-003-HALL",
  "schema_version": "0.1.0",
  "record_status": "in_progress",
  "case_type": "no_homicide_conviction",
  "provenance": {
    "created": "2026-09-05",
    "last_reviewed": "2026-09-05",
    "contributors": [
      "maintainer"
    ],
    "ai_assisted": true
  },
  "exclusion_rationale": {
    "summary": "Hall stands convicted of kidnapping and is serving life without parole. He has never been charged with or convicted of homicide in any jurisdiction. No cause of death was determinable in the case for which he was convicted, and no body has been recovered in any other case attributed to him. He is widely described as one of the most prolific offenders in American history on the strength of confessions he has recanted and which investigators have been unable to corroborate. He therefore cannot enter the offender roster, where he would contribute an unproven victim count to every aggregate computed from this dataset.",
    "criteria_failed": [
      "Criterion 2 — conviction for homicide",
      "Criterion 3 — two or more victims in separate events"
    ],
    "not_an_exoneration": true
  },
  "identity": {
    "legal_name": {
      "value": "Larry DeWayne Hall",
      "confidence": "established",
      "sources": [
        {
          "tier": 1,
          "citation": "United States v. Hall, 93 F.3d 1337 (7th Cir. 1996)",
          "url": "https://law.justia.com/cases/federal/appellate-courts/F3/93/1337/641657/"
        },
        {
          "tier": 1,
          "citation": "United States v. Hall, 165 F.3d 1095 (7th Cir. 1999)",
          "url": "https://caselaw.findlaw.com/court/us-7th-circuit/1436146.html"
        }
      ]
    },
    "aliases": null,
    "media_epithet": {
      "value": null,
      "confidence": "unverified",
      "sources": [],
      "notes": "No contemporaneous press epithet located. Labels attached to him in recent coverage derive from a 2022 television dramatisation and are inadmissible here."
    },
    "birth_date": {
      "value": null,
      "confidence": "unverified",
      "sources": [],
      "notes": "Commonly given as 11 December 1962. No record retrieved; not asserted."
    },
    "birth_place": {
      "value": null,
      "confidence": "unverified",
      "sources": [],
      "notes": "Commonly given as Wabash, Indiana. No record retrieved."
    },
    "death_date": null,
    "judicial_status": {
      "value": "Convicted of kidnapping under 18 U.S.C. § 1201(a)(1). Serving life without parole. NO homicide charge or conviction in any jurisdiction.",
      "confidence": "established",
      "sources": [
        {
          "tier": 1,
          "citation": "United States v. Hall, 165 F.3d 1095 (7th Cir. 1999)",
          "url": "https://caselaw.findlaw.com/court/us-7th-circuit/1436146.html",
          "note": "conviction affirmed on second appeal"
        },
        {
          "tier": 4,
          "citation": "Bustle. 'Suspected Black Bird Serial Killer Larry Hall Was Never Charged With Murder.' 2022.",
          "url": "https://www.bustle.com/entertainment/is-larry-hall-still-in-prison-black-bird"
        }
      ],
      "notes": "This is the field the record exists to state precisely. The conviction is for kidnapping Jessica Roach for sexual gratification and transporting her from Illinois to Indiana. She was found dead. He was not charged with killing her."
    }
  },
  "established": {
    "convictions": {
      "value": [
        {
          "charge": "Kidnapping, 18 U.S.C. § 1201(a)(1) — transporting Jessica Roach from Illinois to Indiana for sexual gratification",
          "jurisdiction": "United States District Court (Central District of Illinois)",
          "date": "1995-06",
          "disposition": "Convicted; life imprisonment. Vacated on appeal 1996; retried and convicted again; affirmed 1999."
        }
      ],
      "confidence": "established",
      "sources": [
        {
          "tier": 1,
          "citation": "United States v. Hall, 93 F.3d 1337 (7th Cir. 1996)",
          "url": "https://law.justia.com/cases/federal/appellate-courts/F3/93/1337/641657/"
        },
        {
          "tier": 1,
          "citation": "United States v. Hall, 165 F.3d 1095 (7th Cir. 1999)",
          "url": "https://caselaw.findlaw.com/court/us-7th-circuit/1436146.html"
        }
      ]
    },
    "sentence": {
      "value": "Life imprisonment without parole. Held at the Federal Correctional Complex, Butner, North Carolina.",
      "confidence": "reported",
      "sources": [
        {
          "tier": 1,
          "citation": "United States v. Hall, 165 F.3d 1095 (7th Cir. 1999)",
          "url": "https://caselaw.findlaw.com/court/us-7th-circuit/1436146.html"
        }
      ],
      "notes": "The facility should be confirmed against a current Bureau of Prisons record if it matters analytically."
    },
    "judicial_findings": {
      "value": "The Seventh Circuit in 1996 held that expert testimony on false confessions had been wrongly excluded and vacated the conviction, ordering a new trial. On remand that expert evidence was admitted after a Daubert analysis, the jury convicted, and the 1999 panel affirmed.",
      "confidence": "established",
      "sources": [
        {
          "tier": 1,
          "citation": "United States v. Hall, 93 F.3d 1337 (7th Cir. 1996)",
          "url": "https://law.justia.com/cases/federal/appellate-courts/F3/93/1337/641657/"
        },
        {
          "tier": 1,
          "citation": "United States v. Hall, 165 F.3d 1095 (7th Cir. 1999)",
          "url": "https://caselaw.findlaw.com/court/us-7th-circuit/1436146.html"
        }
      ],
      "notes": "Both directions matter. A federal appellate court found the confession evidence required expert scrutiny; a jury then heard that scrutiny and convicted anyway. Accounts that cite only one half misrepresent the record."
    },
    "physical_evidence": {
      "value": "None connecting any individual to the offence.",
      "confidence": "reported",
      "sources": [
        {
          "tier": 1,
          "citation": "United States v. Hall, 93 F.3d 1337 (7th Cir. 1996)",
          "url": "https://law.justia.com/cases/federal/appellate-courts/F3/93/1337/641657/"
        }
      ]
    },
    "cause_of_death_determination": {
      "value": "None. The body was recovered approximately six weeks after the disappearance and had been severely damaged by farm machinery; cause of death could not be determined.",
      "confidence": "reported",
      "sources": [
        {
          "tier": 1,
          "citation": "United States v. Hall, 93 F.3d 1337 (7th Cir. 1996)",
          "url": "https://law.justia.com/cases/federal/appellate-courts/F3/93/1337/641657/"
        }
      ],
      "notes": "Decisive and almost universally omitted. Popular accounts state a method of killing; the record establishes that no method could be determined. Hall's statement asserted strangulation — an assertion the forensic evidence could neither confirm nor contradict, which is one of the reliability problems the appellate court identified."
    }
  },
  "not_established": {
    "homicide_attribution": {
      "value": "Investigators have publicly suspected Hall in roughly nineteen further disappearances beyond Jessica Roach. No charge has followed in any of them. In the 1992 Laurie Depies disappearance, officials declined to charge him, citing his record of retracted admissions and the absence of physical evidence.",
      "confidence": "reported",
      "sources": [
        {
          "tier": 4,
          "citation": "Bustle. 'Suspected Black Bird Serial Killer Larry Hall Was Never Charged With Murder.' 2022.",
          "url": "https://www.bustle.com/entertainment/is-larry-hall-still-in-prison-black-bird"
        },
        {
          "tier": 4,
          "citation": "WTHR (Indianapolis). 'Recanted confessions of Larry Hall cast shadow over multiple unsolved Indiana cases.'",
          "url": "https://wthr.com/article/news/crime/recanted-confessions-of-larry-hall-cast-shadow-over-unsolved-indiana-cases-pflum-jennifer-lee-schmidt-felton/531-0950f9a7-2587-4343-baba-efce6cd06220"
        }
      ],
      "notes": "Recorded as what investigators suspect, which is a fact about the investigation, not about Hall. Suspicion sustained over decades without charge is itself the datum."
    },
    "victim_count_claims": {
      "value": "Figures of 'up to 40' and '40 to 50' circulate widely. They originate in expert commentary to news media and in Hall's own retracted admissions. No agency has published an attribution figure with a stated methodology.",
      "confidence": "reported",
      "sources": [
        {
          "tier": 4,
          "citation": "Bustle. 'Suspected Black Bird Serial Killer Larry Hall Was Never Charged With Murder.' 2022.",
          "url": "https://www.bustle.com/entertainment/is-larry-hall-still-in-prison-black-bird"
        }
      ],
      "notes": "Recorded as the provenance of a circulating number, never as a count. This is exactly the figure that would corrupt every aggregate in the dataset if the record sat on the offender roster."
    },
    "circulating_claims": {
      "value": [
        "Carved wooden falcons placed on a map to mark grave sites — originates in a 2022 television dramatisation, not in the record",
        "A '100% correlation' between his attendance at historical reenactments and dates of disappearance — no such analysis exists in any retrievable source",
        "A murder conviction — he has none",
        "A 'Dodge Falcon' van — no such vehicle model exists"
      ],
      "confidence": "established",
      "sources": [
        {
          "tier": 1,
          "citation": "United States v. Hall, 165 F.3d 1095 (7th Cir. 1999)",
          "url": "https://caselaw.findlaw.com/court/us-7th-circuit/1436146.html",
          "note": "establishes the conviction is for kidnapping"
        },
        {
          "tier": 4,